{
  "schemaVersion": 2,
  "generatedAt": "2026-10-20T14:58:21Z",
  "repo": "Chase-perfection/aegis-extensions",
  "extensions": [
    {
      "id": "account-tiering",
      "name": "Account Tiering",
      "version": "0.0.0",
      "manifestVersion": 1,
      "minAppVersion": "1.0.8",
      "labelKey": "nav_account_tiering",
      "descKey": "desc_account_tiering",
      "icon": "users",
      "page": "account-tiering.html",
      "category": "Compliance",
      "routePrefixes": [
        "/api/account-tiering"
      ],
      "requiresHostOptIn": false,
      "file": "account-tiering-0.0.0.zip",
      "size": 86869,
      "sha256": "be8b501bf7bb45da98eb3f82bdfa021d1162459cb6453e91bb114cdba66e1fbe",
      "download": "https://github.com/Chase-perfection/aegis-extensions/releases/download/account-tiering-v0.0.0/account-tiering-0.0.0.zip",
      "manifest": "https://github.com/Chase-perfection/aegis-extensions/releases/download/account-tiering-v0.0.0/account-tiering-0.0.0.manifest.json",
      "signature": "https://github.com/Chase-perfection/aegis-extensions/releases/download/account-tiering-v0.0.0/account-tiering-0.0.0.manifest.json.sig",
      "publishedAt": "2026-10-02T08:05:32Z",
      "channel": "stable",
      "image": "https://raw.githubusercontent.com/Chase-perfection/aegis-extensions/main/extensions/account-tiering/card.png",
      "imageSha256": "ee34b6b188c6c4ae2a01cabaa9f5c9e5adb79b3eed1ef34728f2bb3d08c1e012"
    },
    {
      "id": "deploy",
      "name": "Deploy",
      "version": "0.2.14",
      "manifestVersion": 1,
      "minAppVersion": "1.0.5",
      "labelKey": "nav_deploy",
      "descKey": "desc_deploy",
      "icon": "network",
      "page": "deploy.html",
      "category": "Integrations",
      "routePrefixes": [
        "/api/deploy"
      ],
      "requiresHostOptIn": true,
      "file": "deploy-0.2.14.zip",
      "size": 503566,
      "sha256": "50ad2164455ee41eafd646f6c219bdd8179b42474e366c19c8610c4f40283b61",
      "download": "https://github.com/Chase-perfection/aegis-extensions/releases/download/deploy-v0.2.14/deploy-0.2.14.zip",
      "manifest": "https://github.com/Chase-perfection/aegis-extensions/releases/download/deploy-v0.2.14/deploy-0.2.14.manifest.json",
      "signature": "https://github.com/Chase-perfection/aegis-extensions/releases/download/deploy-v0.2.14/deploy-0.2.14.manifest.json.sig",
      "publishedAt": "2026-10-09T07:54:41Z",
      "channel": "stable",
      "image": "https://raw.githubusercontent.com/Chase-perfection/aegis-extensions/main/extensions/deploy/card.png",
      "imageSha256": "123aa6b66015357dfb46db0db36305dc83ed5b85a29358807d78ce0a8aaba342",
      "prerequisites": [
        {
          "id": "git",
          "required": true,
          "version": "2.56.0"
        },
        {
          "id": "python",
          "version": "3.13.15"
        },
        {
          "id": "node",
          "version": "22.23.3"
        }
      ]
    },
    {
      "id": "network-inventory",
      "name": "Network Inventory",
      "version": "0.0.4",
      "manifestVersion": 1,
      "minAppVersion": "1.0.7",
      "labelKey": "nav_network_inventory",
      "descKey": "desc_network_inventory",
      "icon": "network",
      "page": "network-inventory.html",
      "category": "Inventory",
      "routePrefixes": [
        "/api/inventory"
      ],
      "requiresHostOptIn": false,
      "file": "network-inventory-0.0.4.zip",
      "size": 91413,
      "sha256": "5d69a0151ef1a188f6564a98ae1a18588fdc38ea3c24c439825d617e58f15a79",
      "download": "https://github.com/Chase-perfection/aegis-extensions/releases/download/network-inventory-v0.0.4/network-inventory-0.0.4.zip",
      "manifest": "https://github.com/Chase-perfection/aegis-extensions/releases/download/network-inventory-v0.0.4/network-inventory-0.0.4.manifest.json",
      "signature": "https://github.com/Chase-perfection/aegis-extensions/releases/download/network-inventory-v0.0.4/network-inventory-0.0.4.manifest.json.sig",
      "publishedAt": "2026-10-20T14:58:07Z",
      "channel": "stable",
      "image": "https://raw.githubusercontent.com/Chase-perfection/aegis-extensions/main/extensions/network-inventory/card.png",
      "imageSha256": "78e2d227e841f8c13b3e2ace31211c5dc73d3833baf2c1ba3bda3695e3cf6d2c"
    }
  ]
}
